{
  "format": "tldraw-stroke-recording",
  "version": 1,
  "sdkVersion": "5.5.2",
  "durationMs": 2534.5,
  "viewport": {
    "width": 1920,
    "height": 1080
  },
  "initial": {
    "document": {
      "store": {
        "user:cV0S-B_kS_oPUzOxRk5dL": {
          "name": "",
          "color": "#39B178",
          "imageUrl": "",
          "meta": {},
          "id": "user:cV0S-B_kS_oPUzOxRk5dL",
          "typeName": "user"
        },
        "user:M1txcDJEoq-7qOJI61kBt": {
          "name": "",
          "color": "#02B1CC",
          "imageUrl": "",
          "meta": {},
          "id": "user:M1txcDJEoq-7qOJI61kBt",
          "typeName": "user"
        },
        "page:page": {
          "meta": {},
          "id": "page:page",
          "name": "Page 1",
          "index": "a1",
          "typeName": "page"
        },
        "document:document": {
          "gridSize": 10,
          "name": "",
          "meta": {},
          "id": "document:document",
          "typeName": "document"
        }
      },
      "schema": {
        "schemaVersion": 2,
        "sequences": {
          "com.tldraw.store": 5,
          "com.tldraw.asset": 1,
          "com.tldraw.camera": 1,
          "com.tldraw.document": 2,
          "com.tldraw.instance": 26,
          "com.tldraw.instance_page_state": 5,
          "com.tldraw.page": 1,
          "com.tldraw.instance_presence": 6,
          "com.tldraw.pointer": 1,
          "com.tldraw.shape": 4,
          "com.tldraw.user": 1,
          "com.tldraw.asset.image": 6,
          "com.tldraw.asset.video": 5,
          "com.tldraw.asset.bookmark": 2,
          "com.tldraw.shape.group": 0,
          "com.tldraw.shape.text": 4,
          "com.tldraw.shape.bookmark": 2,
          "com.tldraw.shape.draw": 5,
          "com.tldraw.shape.geo": 12,
          "com.tldraw.shape.note": 13,
          "com.tldraw.shape.line": 5,
          "com.tldraw.shape.frame": 1,
          "com.tldraw.shape.arrow": 8,
          "com.tldraw.shape.highlight": 4,
          "com.tldraw.shape.embed": 4,
          "com.tldraw.shape.image": 5,
          "com.tldraw.shape.video": 4,
          "com.tldraw.binding.arrow": 1
        }
      }
    },
    "session": {
      "version": 0,
      "currentPageId": "page:page",
      "exportBackground": true,
      "isFocusMode": false,
      "isDebugMode": false,
      "isToolLocked": false,
      "isGridMode": false,
      "pageStates": [
        {
          "pageId": "page:page",
          "camera": {
            "x": 0,
            "y": 0,
            "z": 1
          },
          "selectedShapeIds": [],
          "focusedGroupId": null
        }
      ]
    }
  },
  "initialCamera": {
    "x": 0,
    "y": 0,
    "z": 1
  },
  "events": [
    {
      "kind": "create",
      "id": "shape:OuKNItWz4eN0O2YsDAL77",
      "record": {
        "x": 300,
        "y": 400,
        "rotation": 0,
        "isLocked": false,
        "opacity": 1,
        "meta": {},
        "id": "shape:OuKNItWz4eN0O2YsDAL77",
        "type": "draw",
        "props": {
          "segments": [
            {
              "type": "free",
              "path": "AAAAAAAAAAA=",
              "dim": 2
            }
          ],
          "color": "black",
          "fill": "none",
          "dash": "draw",
          "size": "m",
          "isComplete": false,
          "isClosed": false,
          "isPen": false,
          "scale": 1,
          "scaleX": 1,
          "scaleY": 1
        },
        "parentId": "page:page",
        "index": "a1oLf",
        "typeName": "shape"
      },
      "origin": "generated",
      "source": "user",
      "tool": "draw",
      "seq": 0,
      "t": 30.799999997019768
    },
    {
      "kind": "update",
      "id": "shape:OuKNItWz4eN0O2YsDAL77",
      "record": {
        "x": 300,
        "y": 400,
        "rotation": 0,
        "isLocked": false,
        "opacity": 1,
        "meta": {},
        "id": "shape:OuKNItWz4eN0O2YsDAL77",
        "type": "draw",
        "props": {
          "segments": [
            {
              "type": "free",
              "path": "AAAAAAAAAAAATQBC",
              "dim": 2
            }
          ],
          "color": "black",
          "fill": "none",
          "dash": "draw",
          "size": "m",
          "isComplete": false,
          "isClosed": false,
          "isPen": false,
          "scale": 1,
          "scaleX": 1,
          "scaleY": 1
        },
        "parentId": "page:page",
        "index": "a1oLf",
        "typeName": "shape"
      },
      "before": {
        "x": 300,
        "y": 400,
        "rotation": 0,
        "isLocked": false,
        "opacity": 1,
        "meta": {},
        "id": "shape:OuKNItWz4eN0O2YsDAL77",
        "type": "draw",
        "props": {
          "segments": [
            {
              "type": "free",
              "path": "AAAAAAAAAAA=",
              "dim": 2
            }
          ],
          "color": "black",
          "fill": "none",
          "dash": "draw",
          "size": "m",
          "isComplete": false,
          "isClosed": false,
          "isPen": false,
          "scale": 1,
          "scaleX": 1,
          "scaleY": 1
        },
        "parentId": "page:page",
        "index": "a1oLf",
        "typeName": "shape"
      },
      "origin": "generated",
      "source": "user",
      "tool": "draw",
      "seq": 1,
      "t": 42.29999999701977
    },
    {
      "kind": "update",
      "id": "shape:OuKNItWz4eN0O2YsDAL77",
      "record": {
        "x": 300,
        "y": 400,
        "rotation": 0,
        "isLocked": false,
        "opacity": 1,
        "meta": {},
        "id": "shape:OuKNItWz4eN0O2YsDAL77",
        "type": "draw",
        "props": {
          "segments": [
            {
              "type": "free",
              "path": "AAAAAAAAAAAATQBCAE0ASg==",
              "dim": 2
            }
          ],
          "color": "black",
          "fill": "none",
          "dash": "draw",
          "size": "m",
          "isComplete": false,
          "isClosed": false,
          "isPen": false,
          "scale": 1,
          "scaleX": 1,
          "scaleY": 1
        },
        "parentId": "page:page",
        "index": "a1oLf",
        "typeName": "shape"
      },
      "before": {
        "x": 300,
        "y": 400,
        "rotation": 0,
        "isLocked": false,
        "opacity": 1,
        "meta": {},
        "id": "shape:OuKNItWz4eN0O2YsDAL77",
        "type": "draw",
        "props": {
          "segments": [
            {
              "type": "free",
              "path": "AAAAAAAAAAAATQBC",
              "dim": 2
            }
          ],
          "color": "black",
          "fill": "none",
          "dash": "draw",
          "size": "m",
          "isComplete": false,
          "isClosed": false,
          "isPen": false,
          "scale": 1,
          "scaleX": 1,
          "scaleY": 1
        },
        "parentId": "page:page",
        "index": "a1oLf",
        "typeName": "shape"
      },
      "origin": "generated",
      "source": "user",
      "tool": "draw",
      "seq": 2,
      "t": 74.39999999850988
    },
    {
      "kind": "update",
      "id": "shape:OuKNItWz4eN0O2YsDAL77",
      "record": {
        "x": 300,
        "y": 400,
        "rotation": 0,
        "isLocked": false,
        "opacity": 1,
        "meta": {},
        "id": "shape:OuKNItWz4eN0O2YsDAL77",
        "type": "draw",
        "props": {
          "segments": [
            {
              "type": "free",
              "path": "AAAAAAAAAAAATQBCAE0ASkBOAEw=",
              "dim": 2
            }
          ],
          "color": "black",
          "fill": "none",
          "dash": "draw",
          "size": "m",
          "isComplete": false,
          "isClosed": false,
          "isPen": false,
          "scale": 1,
          "scaleX": 1,
          "scaleY": 1
        },
        "parentId": "page:page",
        "index": "a1oLf",
        "typeName": "shape"
      },
      "before": {
        "x": 300,
        "y": 400,
        "rotation": 0,
        "isLocked": false,
        "opacity": 1,
        "meta": {},
        "id": "shape:OuKNItWz4eN0O2YsDAL77",
        "type": "draw",
        "props": {
          "segments": [
            {
              "type": "free",
              "path": "AAAAAAAAAAAATQBCAE0ASg==",
              "dim": 2
            }
          ],
          "color": "black",
          "fill": "none",
          "dash": "draw",
          "size": "m",
          "isComplete": false,
          "isClosed": false,
          "isPen": false,
          "scale": 1,
          "scaleX": 1,
          "scaleY": 1
        },
        "parentId": "page:page",
        "index": "a1oLf",
        "typeName": "shape"
      },
      "origin": "generated",
      "source": "user",
      "tool": "draw",
      "seq": 3,
      "t": 107.19999999552965
    },
    {
      "kind": "update",
      "id": "shape:OuKNItWz4eN0O2YsDAL77",
      "record": {
        "x": 300,
        "y": 400,
        "rotation": 0,
        "isLocked": false,
        "opacity": 1,
        "meta": {},
        "id": "shape:OuKNItWz4eN0O2YsDAL77",
        "type": "draw",
        "props": {
          "segments": [
            {
              "type": "free",
              "path": "AAAAAAAAAAAATQBCAE0ASkBOAExAToBI",
              "dim": 2
            }
          ],
          "color": "black",
          "fill": "none",
          "dash": "draw",
          "size": "m",
          "isComplete": false,
          "isClosed": false,
          "isPen": false,
          "scale": 1,
          "scaleX": 1,
          "scaleY": 1
        },
        "parentId": "page:page",
        "index": "a1oLf",
        "typeName": "shape"
      },
      "before": {
        "x": 300,
        "y": 400,
        "rotation": 0,
        "isLocked": false,
        "opacity": 1,
        "meta": {},
        "id": "shape:OuKNItWz4eN0O2YsDAL77",
        "type": "draw",
        "props": {
          "segments": [
            {